{
  "jpegtran": {
    "desc": "",
    "alias": [],
    "test": ["-version"]
  },
  "mozjpeg": {
    "desc": "",
    "alias": [],
    "test": ["-version"]
  },
  "jpegoptim": {
    "desc": "",
    "alias": [],
    "test": ["-h"]
  },
  "guetzli": {
    "desc": "google 出的",
    "alias": ["jpg"]
  },

  "optipng": {
    "desc": "",
    "alias": [],
    "test": ["-help"]
  },
  "pngcrush": {
    "desc": "",
    "alias": [],
    "test": ["-h"]
  },
  "pngquant": {
    "desc": "",
    "alias": [],
    "test": ["-h"]
  },
  "zopflipng": {
    "desc": "google 出的",
    "alias": ["png"],
    "test": ["-h"]
  },

  "gifsicle": {
    "desc": "",
    "alias": ["gif"],
    "test": ["--help"]
  }
}
